<?xml version="1.0" encoding="UTF-8"?>
<xs:schema xmlns:xs="http://www.w3.org/2001/XMLSchema">
    <xs:element name="list">
        <xs:complexType>
            <xs:sequence>
                <xs:element name="set" maxOccurs="unbounded">
                    <xs:complexType>
                        <xs:sequence>
                            <xs:element name="chest">
                                <xs:complexType>
                                    <xs:attribute name="id" type="xs:positiveInteger" use="required" />
                                </xs:complexType>
                            </xs:element>
                            <xs:element name="legs" maxOccurs="2" minOccurs="0">
                                <xs:complexType>
                                    <xs:attribute name="id" type="xs:positiveInteger" use="required" />
                                </xs:complexType>
                            </xs:element>
                            <xs:element name="gloves" maxOccurs="2" minOccurs="0">
                                <xs:complexType>
                                    <xs:attribute name="id" type="xs:positiveInteger" use="required" />
                                </xs:complexType>
                            </xs:element>
                            <xs:element name="feet" maxOccurs="2" minOccurs="0">
                                <xs:complexType>
                                    <xs:attribute name="id" type="xs:positiveInteger" use="required" />
                                </xs:complexType>
                            </xs:element>
                            <xs:element name="shield" maxOccurs="2" minOccurs="0">
                                <xs:complexType>
                                    <xs:attribute name="id" type="xs:positiveInteger"  />
                                </xs:complexType>
                            </xs:element>
                        </xs:sequence>
                        <xs:attribute name="id" use="required" type="xs:positiveInteger" />
                    </xs:complexType>
                </xs:element>
            </xs:sequence>
        </xs:complexType>
    </xs:element>
</xs:schema>